{
  "metaVersion": "1.0.0",
  "status": "beta",
  "name": "rr-radio-group",
  "summary": "Form-associated group of radio buttons. Renders a fieldset/legend and manages selection and form value for its rr-radio children.",
  "package": "@digital2analogue2/parsimony-components",
  "props": [
    {
      "name": "name",
      "type": "string",
      "default": ""
    },
    {
      "name": "value",
      "type": "string",
      "default": ""
    },
    {
      "name": "label",
      "type": "string",
      "default": ""
    },
    {
      "name": "errorText",
      "type": "string",
      "default": ""
    },
    {
      "name": "required",
      "type": "boolean",
      "default": "false"
    },
    {
      "name": "disabled",
      "type": "boolean",
      "default": "false"
    },
    {
      "name": "orientation",
      "type": "'vertical' | 'horizontal'",
      "default": "vertical"
    }
  ],
  "slots": [
    {
      "name": "default",
      "description": "rr-radio child elements.",
      "accepts": [
        "rr-radio"
      ]
    }
  ],
  "events": [
    {
      "name": "change",
      "detail": "none"
    }
  ],
  "cssParts": [
    {
      "name": "fieldset",
      "description": "The outer fieldset element."
    },
    {
      "name": "legend",
      "description": "The legend / label element."
    }
  ],
  "anatomy": {
    "description": "A fieldset wrapping the projected rr-radio children. The group carries the legend and the error; each option's own colours belong to rr-radio.",
    "parts": [
      {
        "name": "root",
        "element": ":host",
        "description": "Host wrapper. Layout only (display: block) — carries no tokens.",
        "parts": [
          {
            "name": "fieldset",
            "element": "fieldset",
            "cssPart": "fieldset",
            "description": "Semantic grouping element. Borderless and unpadded — carries no tokens."
          },
          {
            "name": "legend",
            "element": "legend",
            "cssPart": "legend",
            "description": "The group label.",
            "tokens": {
              "foreground": "--color-foreground-alt",
              "font": "--font-label-medium",
              "spacing": [
                "--spacing-align",
                "--spacing-tight"
              ]
            },
            "states": [
              {
                "when": "disabled",
                "tokens": {
                  "foreground": "--color-foreground-disabled"
                }
              }
            ]
          },
          {
            "name": "options",
            "element": ".options",
            "description": "The slot container for the rr-radio children.",
            "tokens": {
              "spacing": "--spacing-tight"
            },
            "states": [
              {
                "when": "orientation=horizontal",
                "description": "Row layout opens the gap one step.",
                "tokens": {
                  "spacing": "--spacing-element"
                }
              }
            ]
          },
          {
            "name": "error",
            "element": ".error",
            "description": "Group-level error message (role=alert).",
            "tokens": {
              "foreground": "--color-foreground-danger",
              "font": "--font-label-small",
              "spacing": "--spacing-micro"
            }
          }
        ]
      }
    ]
  },
  "rules": [
    "hard-1",
    "hard-6",
    "hard-9"
  ],
  "guidance": [
    "Place rr-radio elements in the default slot; the group manages their checked state and form value"
  ],
  "examples": [
    {
      "title": "Default vertical group",
      "html": "<rr-radio-group name=\"size\" label=\"Size\" value=\"md\">\n  <rr-radio value=\"sm\">Small</rr-radio>\n  <rr-radio value=\"md\">Medium</rr-radio>\n  <rr-radio value=\"lg\">Large</rr-radio>\n</rr-radio-group>"
    },
    {
      "title": "Horizontal orientation",
      "html": "<rr-radio-group name=\"size\" label=\"Size\" orientation=\"horizontal\">\n  <rr-radio value=\"sm\">Small</rr-radio>\n  <rr-radio value=\"md\">Medium</rr-radio>\n</rr-radio-group>"
    },
    {
      "title": "Error state",
      "html": "<rr-radio-group name=\"size\" label=\"Size\" required error-text=\"Please select a size\">\n  <rr-radio value=\"sm\">Small</rr-radio>\n  <rr-radio value=\"md\">Medium</rr-radio>\n</rr-radio-group>"
    },
    {
      "title": "Disabled group",
      "html": "<rr-radio-group name=\"size\" label=\"Size\" disabled>\n  <rr-radio value=\"sm\">Small</rr-radio>\n  <rr-radio value=\"md\">Medium</rr-radio>\n</rr-radio-group>"
    }
  ],
  "accessibility": {
    "ariaPattern": "https://www.w3.org/WAI/ARIA/apg/patterns/radio/",
    "role": "radiogroup",
    "focusable": false,
    "keyboard": [
      "Arrow keys move selection within the group",
      "Tab moves focus into and out of the group"
    ],
    "wcag": [
      "1.4.3 Contrast (Minimum)",
      "2.1.1 Keyboard",
      "3.3.1 Error Identification",
      "4.1.2 Name, Role, Value"
    ],
    "rules": []
  },
  "figma": {
    "componentKey": "",
    "nodeId": "121:77",
    "codeConnectFile": "radio.figma.ts"
  }
}
