{
  "metaVersion": "1.0.0",
  "status": "beta",
  "name": "rr-avatar",
  "summary": "Circular identity surface showing initials or an image, with size and accent-color variants.",
  "package": "@digital2analogue2/parsimony-components",
  "props": [
    {
      "name": "size",
      "type": "'sm' | 'md' | 'lg' | 'xl'",
      "default": "md"
    },
    {
      "name": "color",
      "type": "'default' | 'indigo' | 'sky' | 'green' | 'amber'",
      "default": "default"
    },
    {
      "name": "name",
      "type": "string",
      "default": ""
    },
    {
      "name": "src",
      "type": "string",
      "default": ""
    },
    {
      "name": "alt",
      "type": "string",
      "default": ""
    }
  ],
  "slots": [
    {
      "name": "default",
      "description": "Optional custom content to replace initials (e.g. an icon)."
    }
  ],
  "events": [],
  "cssParts": [
    {
      "name": "avatar",
      "description": "The root circle element."
    },
    {
      "name": "img",
      "description": "The img element (only when src is set)."
    },
    {
      "name": "initials",
      "description": "The initials text element."
    }
  ],
  "tokensUsed": [
    "--color-background-alt",
    "--color-foreground-alt",
    "--spacing-group",
    "--font-label-strong-small",
    "--spacing-component",
    "--font-label-strong-xsmall",
    "--font-label-strong-medium",
    "--spacing-layout",
    "--color-background-accent-indigo-bold",
    "--color-foreground-accent-on-indigo",
    "--color-background-accent-sky-bold",
    "--color-foreground-accent-on-sky",
    "--color-background-accent-green-bold",
    "--color-foreground-accent-on-green-bold",
    "--color-background-accent-amber-bold",
    "--color-foreground-accent-on-amber-bold"
  ],
  "rules": [
    "hard-1",
    "hard-6",
    "hard-9"
  ],
  "guidance": [
    "Always provide name (or alt when using src) so the avatar has an accessible label"
  ],
  "examples": [
    {
      "title": "Initials",
      "html": "<rr-avatar name=\"River Romney\"></rr-avatar>"
    },
    {
      "title": "Image",
      "html": "<rr-avatar name=\"River Romney\" src=\"/avatar.jpg\" alt=\"River Romney\"></rr-avatar>"
    },
    {
      "title": "Large, colored",
      "html": "<rr-avatar name=\"River Romney\" size=\"lg\" color=\"indigo\"></rr-avatar>"
    }
  ],
  "accessibility": {
    "ariaPattern": "https://www.w3.org/WAI/ARIA/apg/patterns/",
    "role": "img",
    "focusable": false,
    "keyboard": [],
    "wcag": [
      "1.1.1 Non-text Content",
      "1.4.3 Contrast (Minimum)",
      "1.4.11 Non-text Contrast"
    ],
    "rules": [
      "Initials avatars expose role=img with aria-label set to name; the initials text itself is aria-hidden",
      "Image avatars derive alt from the alt prop, falling back to name"
    ]
  },
  "figma": {
    "componentKey": "",
    "nodeId": "119:65",
    "codeConnectFile": "avatar.figma.ts"
  }
}
